Maria[COMMA] a devout Catholic[COMMA] got married and had 10 children.,After her first husband died[COMMA] she remarried and had 10 more children.,A few weeks after her second husband died[COMMA] Maria also passed away.,At Maria's funeral[COMMA] the priest looked skyward and said[COMMA] [QUOTE]At last[COMMA] they're finally together.[QUOTE],Her sister sitting in the front row said[COMMA] [QUOTE]Excuse me[COMMA] Father[COMMA] but do you mean she and her first husband[COMMA] or she and her second husband?[QUOTE],The priest replied[COMMA] [QUOTE]I mean her legs.[QUOTE],
Q: What were Tarzan's last words?,A: Who greased the viiiiiiiine?,
A deacon is in the hospital and his good friend[COMMA] a preacher[COMMA] goes to visit him.,The preacher notices all the medical equipment attached to the deacon.,He kneels by the bed.,The deacon motions to a pad and pen on the nightstand.,The preacher hands his friend the pad and pen[COMMA] and the deacon begins to write.,Suddenly[COMMA] the deacon dies.,At his funeral[COMMA] the preacher delivers the service.,He says[COMMA] [QUOTE]I was with him when he died[COMMA] and as a matter of fact[COMMA] I have his last thought in my coat pocket here.[QUOTE],The preacher pulls out the paper and reads[COMMA] [QUOTE]Please[COMMA] get up.,You're kneeling on my oxygen hose.[QUOTE],
A woman tells her friend she is getting married for the fourth time.,[QUOTE]How wonderful!,I hope you don't mind me asking[COMMA] what happened to your first husband?[QUOTE],[QUOTE]He ate poisonous mushrooms and died.[QUOTE],[QUOTE]Oh[COMMA] how tragic!,What about your second husband?[QUOTE],[QUOTE]He also ate poisonous mushrooms and died.[QUOTE],[QUOTE]Oh[COMMA] how terrible!,I'm almost afraid to ask you about your third husband.[QUOTE],[QUOTE]He died of a broken neck.[QUOTE],[QUOTE]A broken neck?[QUOTE],[QUOTE]He wouldn't eat the mushrooms.[QUOTE],
If I've invested precious time and energy in a relationship[COMMA] and I've been honest and open[COMMA] hanging and coping[COMMA] true blue[COMMA] a good screw[COMMA] to some fly guy who's out constantly getting high[COMMA] then I'm dumped -- suicide is not one of my thoughts.,I'm thinking maybe homicide.,
I know a lady who blew her man's jimmy off because he wanted to be down with O.P.P.,Now he down with No P.P.,
Yo' Mama is so stupid[COMMA] she got stabbed in a drive-by.,
Three guys die and go to Hell.,Satan asks the first guy[COMMA] [QUOTE]What was your daddy when you were alive?[QUOTE],[QUOTE]He was a candle maker.[QUOTE] So[COMMA] Satan burns off the guy's d**k.,Satan asks the second guy[COMMA] [QUOTE]What was your daddy when you were alive?[QUOTE],[QUOTE]He was a rope maker.[QUOTE] So[COMMA] Satan rips off the guy's d**k with a rope.,Satan asks the third guy[COMMA] [QUOTE]What was your daddy when you were alive?[QUOTE],The guy smiles and says[COMMA] [QUOTE]He made lollipops.[QUOTE],
Three friends die in a car accident and attend an orientation in Heaven.,An angel asks[COMMA] [QUOTE]When you are in your casket and your friends and family are mourning you[COMMA] what would you like to hear them say about you?[QUOTE],The first guy says[COMMA] [QUOTE]I would like them to say that I was a great doctor and a loving family man.[QUOTE],The second guy says[COMMA] [QUOTE]I would like them to say that I was a caring husband and a schoolteacher who made a huge difference to kids.[QUOTE],The last guy says[COMMA] [QUOTE]I would like them to say -- LOOK[COMMA] he's moving![QUOTE],
Hey babe[COMMA] rigor mortis has set in[COMMA] if you know what I mean...,
Did it hurt when you fell from Heaven?,Oh no[COMMA] it was probably when I ate your brain.,
We're the perfect match--you're drop-dead gorgeous[COMMA] and I recently dropped dead.,
No[COMMA] you mean over MY dead body!,
What time do you have to be back in Heaven?,Because I have to be back in my grave in about six hours.,
I'm not actually this tall.,I'm sitting on my wallet--and the dead bodies of people whose brains I've eaten.,
I've got the biggest[COMMA] hardest slab in the cemetery!,