The strident prosecutor begins:,''Ladies and gentlemen of the jury[COMMA] the State will prove that this defendant did in fact discard his breeches and insert his member into the innocent sheep; that he did ejaculate into said sheep and remove his member[COMMA] whereupon this sheep turned around and licked his member clean.'',Then one member of the jury turned and whispered to the other juror and said[COMMA] ''The good ones will do that you know.[QUOTE],
Michael Jackson[COMMA] his lawyer[COMMA] and a small[COMMA] cute boy are on a plane when the plane suddenly develops engine troubles.,[QUOTE]Bad news[COMMA][QUOTE] the lawyer said.,[QUOTE]There are only two parachutes.,You and me will go.[QUOTE],[QUOTE]What about the boy?[QUOTE] asks Michael.,[QUOTE]Screw the boy![QUOTE] ,[QUOTE]Do we have time?[QUOTE],
Why are lawyers buried 10 feet underground?,Because deep down[COMMA] they're really not that,bad!,
Why do you need only two pallbearers at a lawyer's, funeral?,There are only two handles on a garbage can.,
A lawyer married a woman who had previously divorced ten husbands.,On their wedding night[COMMA] she told her new husband[COMMA] [QUOTE]Please be gentle[COMMA] I'm still a virgin.[QUOTE],[QUOTE]What?[QUOTE] said the puzzled groom.,[QUOTE]How can that be if you've been married ten times?[QUOTE],[QUOTE]Well[COMMA] Husband #1 was a sales representative; he kept telling me how great it was going to be.,Husband #2 was in software services; he was never really sure how it was supposed to function[COMMA] but he said he'd look into it and get back to me.,Husband #3 was from field services; he said everything checked out diagnostically but he just couldn't get the system up.,Husband #4 was in telemarketing; even though he knew he had the order[COMMA] he didn't know when he would be able to deliver.,Husband #5 was an engineer; he understood the basic process but wanted three years to research[COMMA] implement[COMMA] and design a new state-of-the-art method.,Husband #6 was from finance and administration; he thought he knew how[COMMA] but he wasn't sure whether it was his job or not.,Husband #7 was in marketing; although he had a nice product[COMMA] he was never sure how to position it.,Husband #8 was a psychologist; all he ever did was talk about it.,Husband #9 was a gynecologist; all he did was look at it.,Husband #10 was a stamp collector; all he ever did was...,God!,I miss him!, But now that I've married you[COMMA] I'm really excited![QUOTE],[QUOTE]Good[COMMA][QUOTE] said the new husband[COMMA] [QUOTE]but[COMMA] why?[QUOTE],[QUOTE]You're a lawyer.,This time I know I'm gonna get screwed![QUOTE],
Q: What is the difference between a lawyer and a hooker?, A: A hooker will stop trying to screw you once you''re dead.,
Q: What's the difference between a lawyer and a herd of buffalo?,A: The lawyer charges more.,
Q: What's the difference between a lawyer and a vampire?,A: A vampire only sucks blood at night.,
What's the difference between a rooster and a lawyer?,The rooster clucks defiance.,
A snake and a lawyer both got hit by a car.,What's the difference between em?,The snake had skid marks in front of him.,
Q: What's the difference between a female lawyer and a pitbull?,A: Lipstick.,
What's the difference between a trampoline and a, lawyer?, You take your shoes off to jump on a trampoline.,
Q: What is the difference between a lawyer and a vulture?, A: Wings.,
A little old lady walks into the Bank of Canada with a bag of money.,She insists that she must speak with the president of the bank.,She tells the bank president that she has accumulated several hundred thousand dollars over the years and would like to open a trust in the bank.,The president is curious[COMMA] so he asks her[COMMA] [QUOTE]Where did you get all this money?[QUOTE] The old lady replies[COMMA] [QUOTE]I make bets.[QUOTE],The president then asks[COMMA] [QUOTE]Bets?,What kind of bets?[QUOTE],The old woman says[COMMA] [QUOTE]Well[COMMA] for example[COMMA] I'll bet you $25[COMMA]000 that your balls are square.[QUOTE],[QUOTE]Ha![QUOTE] laughs the president[COMMA] [QUOTE]That's ridiculous -- you can never win that kind of bet![QUOTE],The old lady challenges[COMMA] [QUOTE]So[COMMA] would you like to take my bet?[QUOTE],[QUOTE]Sure[COMMA][QUOTE] says the president[COMMA] [QUOTE]I'll bet $25[COMMA]000 that my balls are not square![QUOTE],The little old lady says[COMMA] [QUOTE]OK.,I'll bring my lawyer with me tomorrow at 10 a.m.,as a witness[COMMA] and we'll see.[QUOTE],The next morning[COMMA] the little old lady appears with her lawyer at the president's office.,[QUOTE]OK[COMMA][QUOTE] she says[COMMA] [QUOTE]Time to drop your pants and settle this bet.[QUOTE],The president complies.,The little old lady peers closely at his balls and asks if she could feel them.,[QUOTE]Well[COMMA] OK[COMMA][QUOTE] says the bank president[COMMA] [QUOTE]since there's so much money on the line.[QUOTE],Just then[COMMA] the lawyer starts banging his head against the wall.,The president asks the old lady[COMMA] [QUOTE]What the hell's the matter with your lawyer?[QUOTE],She replies[COMMA] [QUOTE]I bet him $50[COMMA]000 that at 10 a.m.,today[COMMA] I'd have the president of the Bank of Canada's balls in my hand.[QUOTE],
Q: How many lawyers does it take to build a wall?,A: Depends on how deep you stack them.,
Q: What can a goose do that a duck can't do and a lawyer should do?,A: Stick his bill up his ass.,
Q: What is the ideal weight of a lawyer?,A: About three pounds[COMMA] including the urn.,
What did a lawyer name his daughter?,Sue!,
What do a lawyer and a sperm have in common?, They both hope to be human someday.,
Q: What happens when lawyers take Viagra?,A: They grow taller.,
A guy walks into a post office one day to see a middle-aged[COMMA] balding man standing at the counter methodically placing [QUOTE]Love[QUOTE] stamps on bright pink envelopes with hearts all over them.,He then takes out a perfume bottle and starts spraying scent all over them., His curiosity gets the better of him and he goes up to the balding man and asks him what he's doing.,[QUOTE]I'm sending out 1[COMMA]000 Valentine's Day cards signed[COMMA] 'Guess who?'[QUOTE],[QUOTE]But why?[QUOTE] asks the man.,[QUOTE]I'm a divorce lawyer.[QUOTE],
A grade school teacher asks her students what their parents do for a living.,Billy proudly stands up and announces[COMMA] [QUOTE]My daddy plays piano in a whorehouse.[QUOTE],The teacher is aghast and promptly changes the subject.,Later that day[COMMA] she calls Billy's mother and explains what Billy said.,Billy's mother says[COMMA] [QUOTE]Actually[COMMA] his father's an attorney[COMMA] but how can we explain a thing like that to a seven-year-old?[QUOTE],
Do you know how copper wire was invented?,Two lawyers fighting over a penny.,
Q: Have you heard about the lawyers' word processor?,A: No matter what font you select[COMMA] everything comes out in fine print.,
A Harvard and Yale Law grad met in a washroom during a law convention.,The Harvard graduate said[COMMA] [QUOTE]Didn't they teach you to wash your hands at Yale?[QUOTE] ,The Yale grad responded[COMMA] [QUOTE]They taught us not to piss on our hands.[QUOTE],
What do you call a bus full of lawyers going over, a cliff with three empty seats?,A total waste of space!,
