Backup - What you do when you run across a skunk in the woods.,Bug - The reason you give for calling in sick.,Byte - What your pitbull done to cousin Jethro.,Chip - Pasture muffins that you try not to step in.,Terminal - Time to call the undertaker.,Crash - When you go to Junior's party uninvited.,Digital - The art of counting on your fingers.,Diskette - Female Disco dancer.,Fax - What you lie about to the IRS.,Hacker - Uncle Leroy after 32 years of smoking.,Hardcopy - Picture looked at when selecting tattoos.,Internet - Where cafeteria workers put their hair.,Keyboard - Where you hang the keys to the John Deere.,Mac - Big Bubba's favorite fast food.,Megahertz - How your head feels after 17 beers.,Modem - What you do when the grass gets too high.,Mouse Pad - Where Mickey and Minnie live.,Network - Scooping up a big fish before it breaks the line.,ROM - Where the pope lives.,Screen - Keeps mosquitoes off the porch.,Serial Port - A red wine you drink with breakfast.,Superconductor - Amtrak's Employee of the year.,SCSI (pronounced scuzzi) - What you call your week-old underwear.,,,,,,,,,,,,,,,,,,,,,,,,,,,,,,,,,,,,,,,,,,,,,,,,,,,,,,,,,,,,,,,,,,,,,,,,,,,,,,,,,,,,,,,,,,,,,,,,,,,,,,,,,,,
A French maid was tidying up for a wealthy computer whiz., She commented that he had a nice PC.," He looked frustrated and said[COMMA] ""Yeah[COMMA] it's top of the line[COMMA] but I can't seem to get any programs to start up."," You wouldn't happen to know how these gizmos work[COMMA] do you?""","She replied[COMMA] ""I'm sorry monsieur[COMMA] I would love to help you[COMMA] but oh la la[COMMA] I don't do Windows!"" ",,,,,,,,,,,,,,,,,,,,,,,,,,,,,,,,,,,,,,,,,,,,,,,,,,,,,,,,,,,,,,,,,,,,,,,,,,,,,,,,,,,,,,,,,,,,,,,,,,,,,,,,,,,,,,,,,,,,,,,,,,,,,
Q: What do you get when you mix a rooster with a telephone pole?, A: A 30-foot cock that helps you reach out and touch someone.,,,,,,,,,,,,,,,,,,,,,,,,,,,,,,,,,,,,,,,,,,,,,,,,,,,,,,,,,,,,,,,,,,,,,,,,,,,,,,,,,,,,,,,,,,,,,,,,,,,,,,,,,,,,,,,,,,,,,,,,,,,,,,,,
An elderly lady phoned her telephone company to report that her telephone failed to ring when her friends called - and that on the few occasions when it did ring[COMMA] her pet dog always moaned right before the phone rang.,The telephone repairman proceeded to the scene[COMMA] curious to see this psychic dog or senile elderly lady.,He climbed a nearby telephone pole[COMMA] hooked in his test set[COMMA] and dialed the subscriber's house.,The phone didn't ring right away[COMMA] but then the dog moaned loudly and the telephone began to ring.,Climbing down from the pole[COMMA] the telephone repairman found:,1,The dog was tied to the telephone system's ground wire via a steel chain and collar.,2,The wire connection to the ground rod was loose.,3,The dog was receiving 90 volts of signaling current when the phone number was called.,4,After a couple of such jolts[COMMA] the dog would start moaning and then urinate on himself and the ground.,5,The wet ground would complete the circuit[COMMA] thus causing the phone ,to ring.,Which demonstrates that some problems CAN be fixed by pissing and ,moaning.,,,,,,,,,,,,,,,,,,,,,,,,,,,,,,,,,,,,,,,,,,,,,,,,,,,,,,,,,,,,,,,,,,,,,,,,,,,,,,,,,,,,,,,,,,,,,,,,,,,,,,,,,,,,,,,,
A lawyer[COMMA] an engineer and a mathematician were called in for a test.,The engineer went in first and was asked[COMMA] ''''What is 2+2?'''' The engineer thought awhile and finally answered[COMMA] ''''4.'''', , Then the mathemetician was called in and was asked the same question.,With little thought he replied[COMMA] ''''4.0'''',Then the lawyer was called in[COMMA] and was asked the same question.,The lawyer answered even quicker than the mathematician[COMMA] ''''What do you want it to be?'''',,,,,,,,,,,,,,,,,,,,,,,,,,,,,,,,,,,,,,,,,,,,,,,,,,,,,,,,,,,,,,,,,,,,,,,,,,,,,,,,,,,,,,,,,,,,,,,,,,,,,,,,,,,,,,,,,,,,,,,,,,,
I'd like to do a usability test of your backend.,,,,,,,,,,,,,,,,,,,,,,,,,,,,,,,,,,,,,,,,,,,,,,,,,,,,,,,,,,,,,,,,,,,,,,,,,,,,,,,,,,,,,,,,,,,,,,,,,,,,,,,,,,,,,,,,,,,,,,,,,,,,,,,,,
I have something that needs beta testing.,It's in my pants.,,,,,,,,,,,,,,,,,,,,,,,,,,,,,,,,,,,,,,,,,,,,,,,,,,,,,,,,,,,,,,,,,,,,,,,,,,,,,,,,,,,,,,,,,,,,,,,,,,,,,,,,,,,,,,,,,,,,,,,,,,,,,,,,
The robots will probably adopt that song as their anthem[COMMA] and they'll sing it to themselves as they take over the world[COMMA] crushing humans under their silicone heels.,And they will install Cher as their android goddess because[COMMA] by then[COMMA] she'll be mostly plastic and wire anyways.,,,,,,,,,,,,,,,,,,,,,,,,,,,,,,,,,,,,,,,,,,,,,,,,,,,,,,,,,,,,,,,,,,,,,,,,,,,,,,,,,,,,,,,,,,,,,,,,,,,,,,,,,,,,,,,,,,,,,,,,,,,,,,,,
Who invented the first computer in Biblical Times?, ,Eve -- she had an Apple in one hand and a Wang in the other!,,,,,,,,,,,,,,,,,,,,,,,,,,,,,,,,,,,,,,,,,,,,,,,,,,,,,,,,,,,,,,,,,,,,,,,,,,,,,,,,,,,,,,,,,,,,,,,,,,,,,,,,,,,,,,,,,,,,,,,,,,,,,,,
We'd go together like a monomer and reaction initialiser.,,,,,,,,,,,,,,,,,,,,,,,,,,,,,,,,,,,,,,,,,,,,,,,,,,,,,,,,,,,,,,,,,,,,,,,,,,,,,,,,,,,,,,,,,,,,,,,,,,,,,,,,,,,,,,,,,,,,,,,,,,,,,,,,,
What do Microsoft and a halter top have in common?, ,Both offer very little support!,,,,,,,,,,,,,,,,,,,,,,,,,,,,,,,,,,,,,,,,,,,,,,,,,,,,,,,,,,,,,,,,,,,,,,,,,,,,,,,,,,,,,,,,,,,,,,,,,,,,,,,,,,,,,,,,,,,,,,,,,,,,,,,
Your eyes are a deep shade of a recessive genetic trait.,I like that.,,,,,,,,,,,,,,,,,,,,,,,,,,,,,,,,,,,,,,,,,,,,,,,,,,,,,,,,,,,,,,,,,,,,,,,,,,,,,,,,,,,,,,,,,,,,,,,,,,,,,,,,,,,,,,,,,,,,,,,,,,,,,,,,
As a computer[COMMA] I find your faith in technology amusing.,,,,,,,,,,,,,,,,,,,,,,,,,,,,,,,,,,,,,,,,,,,,,,,,,,,,,,,,,,,,,,,,,,,,,,,,,,,,,,,,,,,,,,,,,,,,,,,,,,,,,,,,,,,,,,,,,,,,,,,,,,,,,,,,,
Did you hear about the new Mike Tyson Computer?, ,It has two bytes and no memory.,,,,,,,,,,,,,,,,,,,,,,,,,,,,,,,,,,,,,,,,,,,,,,,,,,,,,,,,,,,,,,,,,,,,,,,,,,,,,,,,,,,,,,,,,,,,,,,,,,,,,,,,,,,,,,,,,,,,,,,,,,,,,,,
Q: Did you hear about the new computer upgrade for erectile dysfunction?,"A: It turns your 3.5"" floppy into a hard drive.",,,,,,,,,,,,,,,,,,,,,,,,,,,,,,,,,,,,,,,,,,,,,,,,,,,,,,,,,,,,,,,,,,,,,,,,,,,,,,,,,,,,,,,,,,,,,,,,,,,,,,,,,,,,,,,,,,,,,,,,,,,,,,,,
My hard drive upgrades every time I look at you.,,,,,,,,,,,,,,,,,,,,,,,,,,,,,,,,,,,,,,,,,,,,,,,,,,,,,,,,,,,,,,,,,,,,,,,,,,,,,,,,,,,,,,,,,,,,,,,,,,,,,,,,,,,,,,,,,,,,,,,,,,,,,,,,,
My mission?,A straight shot to Uranus.,,,,,,,,,,,,,,,,,,,,,,,,,,,,,,,,,,,,,,,,,,,,,,,,,,,,,,,,,,,,,,,,,,,,,,,,,,,,,,,,,,,,,,,,,,,,,,,,,,,,,,,,,,,,,,,,,,,,,,,,,,,,,,,,
A woman arrives at the Pearly Gates and finds St.,Peter is not there[COMMA] but a computer terminal is sitting next to the arch.,"She walks up to it and sees[COMMA] ""Welcome to www.Heaven.com.","Please enter your User ID and Password to continue."" ",She doesn't have either[COMMA] but underneath the fields is a small line reading:,"Forgot your ID or Password?,Click Here. So she does.","Up pops a screen that reads[COMMA] ""Please enter at least two of the following[COMMA] and your pasword and ID will be e-mailed to you.""","The fields included ""Name[COMMA]"" ""Date of birth[COMMA]"" ""Date of death[COMMA]"" and ""Favorite Food.""","The woman enters her name and date of birth[COMMA] and clicks ""Submit.""","Up pops another screen that reads[COMMA] ""We are sorry[COMMA] we did not find a match in our database.","Would you like to register?"" So the woman clicks the button marked ""Yes.""",A long and detailed form appears on the screen[COMMA] and the woman spends some time filling it out.,"Then she clicks the ""Submit"" button.","Now she is faced with a screen reading[COMMA] ""We are sorry[COMMA] this service is temporarily unavailable.","Please try again later.""","There is a button marked ""Back."" She clicks it.",A new page appears.,"It reads[COMMA] ""Welcome to www.Purgatory.com."," Please enter your User ID and Password to continue...""",,,,,,,,,,,,,,,,,,,,,,,,,,,,,,,,,,,,,,,,,,,,,,,,,,,,,,,,,,,,,,,,,,,,,,,,,,,,,,,,,,,,,,,,,,,,,,,,,,,,,,,,,,,,,,,
Monica Lewinsky virus: Sucks all the memory out of your,computer.,Ronald Reagan virus: Saves your data[COMMA] but, forgets where it is stored.,Mike Tyson, virus: Quits after one byte.,Oprah Winfrey, virus: Your 200MB hard drive suddenly shrinks to,80MB[COMMA], and then slowly expands to 300MB.,Lorena Bobbit, virus: Turns your hard disk into a 3.5 inch floppy.,Dr., Jack Kevorkian virus: Searches your hard drive for old files, and,deletes them.,Ellen Degeneres virus: Your IBM suddenly,claims it's a MAC.,Titanic virus: Makes your, whole computer go down.,Disney, virus: Everything in the computer goes Goofy.,Prozac, virus: Screws up your RAM, but your processor,doesn't care.,Sharon Stone, virus: Makes a huge initial impact[COMMA] then you forget,it's, there.,Tim Allen virus: Appears helpful[COMMA] only to destroy your hard drive,upon contact.,HBO, virus: Runs the same programs over and over[COMMA] week,after week after week.,Woody Allen, virus: Bypasses the motherboard and turns on,a.,daughter card.,NFL Blackout virus: Will, only let you run progams on a,remote terminal that's more than 75, miles away.,Linda Tripp virus: Makes copies of your, personal files and forwards,them to the authorities.,Bill Clinton, virus: Won't let you query the system for,information., Rush,Limbaugh virus: Biases everything, to the right.,Ken Starr virus: Expands a focused, search of a specific file,into a global interregation of every, existing file.,Creates links between unrelated,data., Works extremely,slow while searching and compiling results.,Al Gore, virus: Runs quietly in background mode, but,doesn't appear to really do much of anything.,Saddam Hussein, virus: Won't let you into any of your programs.,Tonya, Harding virus: Turns your,BAT files into lethal weapons.,George Michael virus: Runs its course[COMMA], occasionally releasing excess data,buildup.,Joey Buttafuoco, virus: Only attacks minor files.,Jerry Seinfeld, virus: Program about nothing that exits, when,you're really enjoying it.,David Caruso NYPD Blue virus: , After running successfully for a while[COMMA] it exits,the program it was in,and never works again.,Pee Wee Herman virus: Exposes your,confidential files to everyone.,X-files, virus: All your Icons start, shape shifting.,Spice Girl virus: Has no real, function[COMMA] but makes a pretty,desktop.,AT&amp;T, virus: Every 3 minutes it tells you what great,service you are getting.,Arnold Schwarzenegger, virus: Terminates and stays resident.,It'll be back.,,,,,,,,,,,,,,,,,,,,,,,,,,,,,,,,,,
A man was mowing his lawn when he heard his neighbor[COMMA] who happened to be a blonde[COMMA] come out of her house.,She opened her mailbox[COMMA] looked inside and slammed it shut.,She stomped her foot and went back inside.,The man thought ''how weird.'' ,A few minutes passed and sure enough[COMMA] the blonde came out of her house again[COMMA] checked her mail box[COMMA] stamped her foot and went back inside.,The man stopped mowing and checked her mailbox to see what was so wrong with it.,After seeing nothing[COMMA] he went back to mowing just shrugging his shoulders.,As soon as he heard her coming out again[COMMA] he shut off his mowing machine and went up to her.,''What in the world are you doing[COMMA] coming out here every five minutes?'' ,The blonde looked up at the man and said[COMMA] ''Well[COMMA] you see[COMMA] there's this little voice in my house that keeps on saying[COMMA] 'You've got mail[COMMA]' but when I come out here to check[COMMA] I don't have any.'',,,,,,,,,,,,,,,,,,,,,,,,,,,,,,,,,,,,,,,,,,,,,,,,,,,,,,,,,,,,,,,,,,,,,,,,,,,,,,,,,,,,,,,,,,,,,,,,,,,,,,,,,,,,,,,,,,,,,,,,
"Blonde: ""Doc[COMMA] you've gotta help me.","I keep hearing voices.""","Doc: ""When are you hearing these voices?""","Blonde: ""When I'm on the telephone.""",,,,,,,,,,,,,,,,,,,,,,,,,,,,,,,,,,,,,,,,,,,,,,,,,,,,,,,,,,,,,,,,,,,,,,,,,,,,,,,,,,,,,,,,,,,,,,,,,,,,,,,,,,,,,,,,,,,,,,,,,,,,,,
Q: What is the difference between sex and computers?,A: With computers[COMMA] the software goes into the hardware.,With sex[COMMA] the hardware goes into the software.,,,,,,,,,,,,,,,,,,,,,,,,,,,,,,,,,,,,,,,,,,,,,,,,,,,,,,,,,,,,,,,,,,,,,,,,,,,,,,,,,,,,,,,,,,,,,,,,,,,,,,,,,,,,,,,,,,,,,,,,,,,,,,,
How is a computer like Britney Spears?,They're both cheap[COMMA] white[COMMA] and plastic.,,,,,,,,,,,,,,,,,,,,,,,,,,,,,,,,,,,,,,,,,,,,,,,,,,,,,,,,,,,,,,,,,,,,,,,,,,,,,,,,,,,,,,,,,,,,,,,,,,,,,,,,,,,,,,,,,,,,,,,,,,,,,,,,
$ Michael Jordan having ,retired[COMMA],with $40 million in endorsements[COMMA] makes $178[COMMA]100 a day[COMMA] working or not.,$ If he sleeps 7 hours a night[COMMA] he makes,$52[COMMA]000 every night while visions of sugarplums dance in his head.,$ If he goes to see a movie[COMMA] it'll cost him,$7.00[COMMA] but he'll make $18[COMMA]550 while he's there.,$ If he decides to have a 5 minute egg[COMMA] he'll,make $618 while boiling it.,$ He makes $7[COMMA]415/hr more than minimum wage.,$ He'll make $3[COMMA]710 while watching each,episode of Friends.,$ If he wanted to save up for a new Acura NSX,($90[COMMA]000) it would take him a whole 12 hours.,$ If someone were to hand him his salary and,endorsement money[COMMA] they would have to do it at the rate of $2.00 every second.,$ He'll probably pay around $200 for a nice,round of golf[COMMA] but will be reimbursed $33[COMMA]390 for that round.,$ Assuming he puts the federal maximum of 15%,of his income into a tax deferred account (401k)[COMMA] his contributions will hit the federal,cap of $9500 at 8:30 a.m.,on January 1st.,$ If you were given a penny for every 10,dollars he made[COMMA] you 'd be living comfortably at $65[COMMA]000 a year.,$ He'll make about $19.60 while watching the,100 meter dash in the Olympics[COMMA] and about $15[COMMA]600 during the Boston Marathon.,$ While the common person is spending about,$20 for a meal in his trendy Chicago restaurant[COMMA] he'll pull in about $5600.,$ This year[COMMA] he'll make more than twice as,much as all U.S.,past presidents for all of their terms combined.,Amazing isn't it?, However...,$ If Jordan saves 100% of his income for the,next 450 years[COMMA] he'll still have less than Bill Gates has today.,$$$ Game over., Nerd wins.,,,,,,,,,,,,,,,,,,,,,,,,,,,,,,,,,,,,,,,,,,,,,,,,,,,,,,,,,,,,,,,,,,,,,,,,,,,,,,,,,,,,,,,,,,,,,
Q: What's the difference between mechanical engineers and civil engineers?,A: Mechanical engineers build weapons; civil engineers build targets.,,,,,,,,,,,,,,,,,,,,,,,,,,,,,,,,,,,,,,,,,,,,,,,,,,,,,,,,,,,,,,,,,,,,,,,,,,,,,,,,,,,,,,,,,,,,,,,,,,,,,,,,,,,,,,,,,,,,,,,,,,,,,,,,
How is a computer like an air conditioner?,When you open Windows it won't work!,,,,,,,,,,,,,,,,,,,,,,,,,,,,,,,,,,,,,,,,,,,,,,,,,,,,,,,,,,,,,,,,,,,,,,,,,,,,,,,,,,,,,,,,,,,,,,,,,,,,,,,,,,,,,,,,,,,,,,,,,,,,,,,,
I enjoy long walks away from sand and water.,,,,,,,,,,,,,,,,,,,,,,,,,,,,,,,,,,,,,,,,,,,,,,,,,,,,,,,,,,,,,,,,,,,,,,,,,,,,,,,,,,,,,,,,,,,,,,,,,,,,,,,,,,,,,,,,,,,,,,,,,,,,,,,,,
Can I watch while you Google yourself?,,,,,,,,,,,,,,,,,,,,,,,,,,,,,,,,,,,,,,,,,,,,,,,,,,,,,,,,,,,,,,,,,,,,,,,,,,,,,,,,,,,,,,,,,,,,,,,,,,,,,,,,,,,,,,,,,,,,,,,,,,,,,,,,,
Q: What did the baby digital watch say to the mommy analog watch?,"A: ""Look Ma[COMMA] no hands!""",,,,,,,,,,,,,,,,,,,,,,,,,,,,,,,,,,,,,,,,,,,,,,,,,,,,,,,,,,,,,,,,,,,,,,,,,,,,,,,,,,,,,,,,,,,,,,,,,,,,,,,,,,,,,,,,,,,,,,,,,,,,,,,,
You and I appear to be on the same wavelength.,If not[COMMA] I have an adapter for that.,,,,,,,,,,,,,,,,,,,,,,,,,,,,,,,,,,,,,,,,,,,,,,,,,,,,,,,,,,,,,,,,,,,,,,,,,,,,,,,,,,,,,,,,,,,,,,,,,,,,,,,,,,,,,,,,,,,,,,,,,,,,,,,,
Do you have a webcam in your pocket?,'Cause I can definitely see myself in your pants.,,,,,,,,,,,,,,,,,,,,,,,,,,,,,,,,,,,,,,,,,,,,,,,,,,,,,,,,,,,,,,,,,,,,,,,,,,,,,,,,,,,,,,,,,,,,,,,,,,,,,,,,,,,,,,,,,,,,,,,,,,,,,,,,
#NAME?,#NAME?,-- If you start dancing in the street[COMMA] everyone you bump into will know all the steps.,#NAME?,-- It does not matter if you are heavily outnumbered in a fight involving martial arts[COMMA] your enemies will wait patiently to attack you one by one[COMMA] dancing around in a threatening manner until you have knocked out their predecessors.,-- After a person suffers a massive blow to the head[COMMA] they will still be surprisingly good looking.,-- No one involved in a car chase[COMMA] hijacking[COMMA] explosion[COMMA] volcanic eruption or alien invasion will ever go into shock.,-- Partnering police officers with their total opposites will always[COMMA] eventually[COMMA] lead to buddy teams who share unbreakable bonds and gruff affection.,,,,,,,,,,,,,,,,,,,,,,,,,,,,,,,,,,,,,,,,,,,,,,,,,,,,,,,,,,,,,,,,,,,,,,,,,,,,,,,,,,,,,,,,,,,,,,,,,,,,,,,,,,,,,,,,,,,,,,,,,,
Q.,Why did God invent men?,A: Vibrators can't mow the lawn.,,,,,,,,,,,,,,,,,,,,,,,,,,,,,,,,,,,,,,,,,,,,,,,,,,,,,,,,,,,,,,,,,,,,,,,,,,,,,,,,,,,,,,,,,,,,,,,,,,,,,,,,,,,,,,,,,,,,,,,,,,,,,,,
Q: Why does the TV like the remote?,A: Because it turns it on!,,,,,,,,,,,,,,,,,,,,,,,,,,,,,,,,,,,,,,,,,,,,,,,,,,,,,,,,,,,,,,,,,,,,,,,,,,,,,,,,,,,,,,,,,,,,,,,,,,,,,,,,,,,,,,,,,,,,,,,,,,,,,,,,
MICROSOFT NEWS RELEASE:,It has come to our attention that a few copies of the Georgia edition of Windows 98 may have accidentally been shipped outside Georgia.,If you have one of the Georgia editions you may need some help understanding the,commands.,The Georgia edition may be recognized by looking at the opening screen., It reads WINDERS 98 with a,background picture of the General Lee super imposed on a Confederate flag.,It is shipped,with a Daisy Duke screen saver.,Also note:,Recycle Bin is labeled Outhouse,My Computer is called This Infernal Contraption,Dialup Networking is called Good Ol' Boys,Control Panel is known as the Dern Dashboard,Hard Drive is referred to as 4 wheel drive,Floppies are them little ole plastic disc thangs.,Other features:, Instead of an error message you get,a winder covered with a garbage bag and duct tape.,OK = ats aww-right,cancel = hail no,reset = awa shoot,yes = shore,no = Naaaa,find = hunt-fer it,go to = over yonder,back = back yonder,help = hep me out here,stop = ternit off,start = crank it up,settings = sittins,programs = stuff that does stuff,documents = stuff I done done, Also note that winders 98 does not,recognize capital letters or punctuation marks., Some programs that are exclusive to,winders 98:,tiperiter................A word processor,colering book............a graphics program,addin mershene...........calculator,scratch paper,..........notepad,jupe-box,...............CD Player,inner-net................Microsoft Explorer,pichers..................A graphics viewer,IRS......................M/S accounting software,IRS2.....................M/S accounting software with hidden files,coon dog.................American kennel club records,fishin...................Bass Anglers Sportsman Society records.,NRA......................National Rifle Association,shot gun,...............Remington Arms price list,riffel...................Winchester price list,pisstel..................Smith &amp; Wesson price list,truck....................Ford &amp; Chevrolet dealers in GA.,by zip code,house....................Nearest Mobil home repair service by zip code,car,....................same as truck[COMMA] just need two lists in Texas,cuzzins..................family history usually a 3 meg file,tax records..............usually an empty file,shells...................ammunition inventory[COMMA] another 3 meg file,bud......................list of Budwiser dealers by zip code,racin....................NASCAR racing schedule includes list of TV stations that carry,the race car n' truck,Parts.......nearest Junk yard by zip code,doc,....................veterinarians by zip code, We regret any inconvenience it may,have caused if you received a copy of the Georgia edition.,You may return it to Microsoft,for a replacement version.,,,,,,,,,,,,,,,,,,,,,,,,,,,,,,,,,,,,,,,,,,,,,,,,,,,,,,,,,
Q: What's the difference between a woman and a computer?, ,A:,Women don't take 3 1/2'' floppies.,,,,,,,,,,,,,,,,,,,,,,,,,,,,,,,,,,,,,,,,,,,,,,,,,,,,,,,,,,,,,,,,,,,,,,,,,,,,,,,,,,,,,,,,,,,,,,,,,,,,,,,,,,,,,,,,,,,,,,,,,,,,,,
This is a true story from the WordPerfect helpline.,Needless to say[COMMA] the help desk employee was fired; however[COMMA] he/she is currently suing the Word Perfect organization for ,Termination without Cause.,Actual dialogue of a former WordPerfect Customer Support employee with a caller:,Ridge Hall computer assistant; may I help you?,Yes[COMMA] well[COMMA] I'm having trouble with WordPerfect.,What sort of trouble?,Well[COMMA] I was just typing along[COMMA] and all of a sudden the words,went away.,Went away?,They disappeared.,Hmm.,So what does your screen look like now?,Nothing.,Nothing?,It's blank; it won't accept anything when I type.,Are you still in WordPerfect[COMMA] or did you get out?,How do I tell?,Can you see the C: prompt on the screen?,What's a sea-prompt?,Never mind.,Can you move the cursor around on the,screen?,There isn't any cursor[COMMA] I told you[COMMA] it won't accept anything I,type.,Does your monitor have a power indicator?,What's a monitor?,It's the thing with the screen on it that looks like a,TV., Does it have a little light that tells you when it's on?,I don't know.,Well[COMMA] then look on the back of the monitor and find where the,power cord goes into it.,Can you see that?,Yes[COMMA] I think so.,Great.,Follow the cord to the plug[COMMA] and tell me if it's,plugged into the wall.,.......Yes[COMMA] it is.,When you were behind the monitor[COMMA] did you notice that there,were two cables plugged into the back of it[COMMA] not just one?,No.,Well[COMMA] there are.,I need you to look back there again and find,the other cable.,.......Okay[COMMA] here it is.,Follow it for me[COMMA] and tell me if it's plugged securely into,the back of your computer.,I can't reach.,Uh huh.,Well[COMMA] can you see if it is?,No.,Even if you maybe put your knee on something and lean way,over?,Oh[COMMA] it's not because I don't have the right angle - it's,because it's dark.,Dark?,Yes - the office light is off[COMMA] and the only light I have is,coming in, from the window.,Well[COMMA] turn on the office light then.,I can't.,No.,Why not?,Because there's a power outage.,A power...,A power outage?,Ah[COMMA] Okay[COMMA] we've got it licked now.,Do you still have the boxes and manuals and packing stuff your computer came in?, ,Well[COMMA] yes[COMMA] I keep them in the closet.,Good.,Go get them[COMMA] and unplug your system and pack it up just,like it was when you got it.,Then take it back to the store you bought it from.,Really?,Is it that bad?,Yes[COMMA] I'm afraid it is.,Well[COMMA] all right then[COMMA] I suppose.,What do I tell them?,Tell them you're too stupid to own a computer.,,,,,,,,,,,,,,,,,,,,,,,,,,,,,,,,,,,,,,,,,,,,,,,,,
